[
  {
    "id": "open-your-eyes",
    "locationId": "cryopod",
    "durationSeconds": 2,
    "maxCompletions": 1,
    "role": "progression",
    "rewards": [],
    "results": [
      { "kind": "chat", "messageKey": "event.cryopod.memory", "delaySeconds": 1 },
      { "kind": "chat", "messageKey": "event.cryopod.choices", "delaySeconds": 2 }
    ]
  },
  {
    "id": "force-pod-lid",
    "locationId": "cryopod",
    "durationSeconds": 12,
    "maxCompletions": 1,
    "role": "progression",
    "visibleWhen": { "kind": "not", "condition": { "kind": "state-variable", "variable": "action-completions:open-your-eyes", "comparison": "less-than", "value": 1 } },
    "rewards": [],
    "results": [{ "kind": "relocate", "locationId": "cryobay" }]
  },
  {
    "id": "work-manual-release",
    "locationId": "cryopod",
    "durationSeconds": 6,
    "maxCompletions": 1,
    "role": "progression",
    "visibleWhen": { "kind": "not", "condition": { "kind": "state-variable", "variable": "action-completions:open-your-eyes", "comparison": "less-than", "value": 1 } },
    "rewards": [],
    "results": [{ "kind": "relocate", "locationId": "cryobay" }]
  },
  {
    "id": "open-emergency-locker",
    "locationId": "cryobay",
    "durationSeconds": 8,
    "maxCompletions": 1,
    "role": "progression",
    "rewards": [],
    "results": [
      { "kind": "item", "itemId": "space-suit", "amount": 1 },
      { "kind": "item", "itemId": "air-canister", "amount": 2 },
      { "kind": "item", "itemId": "water-pouch", "amount": 1 },
      { "kind": "item", "itemId": "food-ration", "amount": 1 }
    ]
  },
  {
    "id": "inspect-cryobay-airlock",
    "locationId": "cryobay",
    "durationSeconds": 5,
    "maxCompletions": 1,
    "role": "optional",
    "rewards": []
  },
  {
    "id": "watch-the-stars",
    "locationId": "cryobay",
    "durationSeconds": 7,
    "maxCompletions": 1,
    "role": "optional",
    "rewards": []
  },
  {
    "id": "check-cryobay-console",
    "locationId": "cryobay",
    "durationSeconds": 6,
    "maxCompletions": 1,
    "role": "optional",
    "rewards": []
  },
  {
    "id": "inspect-other-cryopods",
    "locationId": "cryobay",
    "durationSeconds": 7,
    "maxCompletions": 1,
    "role": "optional",
    "rewards": [],
    "results": [{ "kind": "flag", "flagId": "cryopods-inspected", "value": true }]
  },
  {
    "id": "put-on-space-suit",
    "locationId": "cryobay",
    "durationSeconds": 8,
    "maxCompletions": 1,
    "role": "progression",
    "visibleWhen": {
      "kind": "all",
      "conditions": [
        { "kind": "not", "condition": { "kind": "state-variable", "variable": "item:space-suit", "comparison": "less-than", "value": 1 } },
        { "kind": "state-variable", "variable": "flag:wearing-space-suit", "comparison": "equal", "value": false }
      ]
    },
    "requirements": { "kind": "not", "condition": { "kind": "state-variable", "variable": "item:space-suit", "comparison": "less-than", "value": 1 } },
    "rewards": [],
    "results": [
      { "kind": "flag", "flagId": "wearing-space-suit", "value": true },
      { "kind": "resource", "resourceId": "air-capacity", "amount": 100 }
    ]
  },
  {
    "id": "open-cryobay-airlock",
    "locationId": "cryobay",
    "durationSeconds": 6,
    "maxCompletions": 1,
    "role": "progression",
    "visibleWhen": {
      "kind": "all",
      "conditions": [
        { "kind": "state-variable", "variable": "flag:wearing-space-suit", "comparison": "equal", "value": true },
        { "kind": "state-variable", "variable": "flag:airlock-open", "comparison": "equal", "value": false }
      ]
    },
    "requirements": { "kind": "state-variable", "variable": "resource:air-capacity", "comparison": "greater-than", "value": 0 },
    "rewards": [],
    "results": [{ "kind": "flag", "flagId": "airlock-open", "value": true }]
  },
  {
    "id": "replace-air-canister",
    "locationId": "cryobay",
    "durationSeconds": 5,
    "maxCompletions": 2,
    "role": "utility",
    "visibleWhen": { "kind": "state-variable", "variable": "flag:wearing-space-suit", "comparison": "equal", "value": true },
    "requirements": {
      "kind": "all",
      "conditions": [
        { "kind": "not", "condition": { "kind": "state-variable", "variable": "item:air-canister", "comparison": "less-than", "value": 1 } },
        { "kind": "not", "condition": { "kind": "state-variable", "variable": "resource:air-capacity", "comparison": "greater-than", "value": 50 } }
      ]
    },
    "rewards": [],
    "results": [
      { "kind": "item", "itemId": "air-canister", "amount": -1 },
      { "kind": "resource", "resourceId": "air-capacity", "amount": 50 }
    ]
  },
  {
    "id": "cross-cryobay-airlock",
    "locationId": "cryobay",
    "durationSeconds": 10,
    "maxCompletions": 1,
    "role": "progression",
    "visibleWhen": { "kind": "state-variable", "variable": "flag:airlock-open", "comparison": "equal", "value": true },
    "requirements": { "kind": "state-variable", "variable": "resource:air-capacity", "comparison": "greater-than", "value": 0 },
    "rewards": [],
    "results": [{ "kind": "relocate", "locationId": "main-intersection" }]
  },
  {
    "id": "read-junction-map",
    "locationId": "main-intersection",
    "durationSeconds": 5,
    "maxCompletions": 1,
    "role": "optional",
    "requirements": { "kind": "state-variable", "variable": "resource:air-capacity", "comparison": "greater-than", "value": 0 },
    "rewards": [],
    "results": [{ "kind": "flag", "flagId": "junction-map-read", "value": true }]
  },
  {
    "id": "inspect-intersection-damage",
    "locationId": "main-intersection",
    "durationSeconds": 6,
    "maxCompletions": 1,
    "role": "optional",
    "requirements": { "kind": "state-variable", "variable": "resource:air-capacity", "comparison": "greater-than", "value": 0 },
    "rewards": []
  },
  {
    "id": "trace-captain-deck-route",
    "locationId": "main-intersection",
    "durationSeconds": 7,
    "maxCompletions": 1,
    "role": "progression",
    "requirements": { "kind": "state-variable", "variable": "resource:air-capacity", "comparison": "greater-than", "value": 0 },
    "rewards": [],
    "results": [{ "kind": "flag", "flagId": "captain-route-found", "value": true }]
  },
  {
    "id": "follow-captain-route",
    "locationId": "main-intersection",
    "durationSeconds": 12,
    "maxCompletions": 1,
    "role": "progression",
    "visibleWhen": { "kind": "state-variable", "variable": "flag:captain-route-found", "comparison": "equal", "value": true },
    "requirements": { "kind": "state-variable", "variable": "resource:air-capacity", "comparison": "greater-than", "value": 0 },
    "rewards": [],
    "results": [{ "kind": "relocate", "locationId": "captain-quarters" }]
  },
  {
    "id": "review-captains-terminal",
    "locationId": "captain-quarters",
    "durationSeconds": 8,
    "maxCompletions": 1,
    "role": "optional",
    "requirements": { "kind": "state-variable", "variable": "resource:air-capacity", "comparison": "greater-than", "value": 0 },
    "rewards": []
  },
  {
    "id": "inspect-communications-console",
    "locationId": "captain-quarters",
    "durationSeconds": 7,
    "maxCompletions": 1,
    "role": "progression",
    "requirements": { "kind": "state-variable", "variable": "resource:air-capacity", "comparison": "greater-than", "value": 0 },
    "rewards": [],
    "results": [{ "kind": "flag", "flagId": "communications-ready", "value": true }]
  },
  {
    "id": "send-distress-beacon",
    "locationId": "captain-quarters",
    "durationSeconds": 15,
    "maxCompletions": 1,
    "role": "progression",
    "visibleWhen": { "kind": "state-variable", "variable": "flag:communications-ready", "comparison": "equal", "value": true },
    "requirements": { "kind": "state-variable", "variable": "resource:air-capacity", "comparison": "greater-than", "value": 0 },
    "rewards": []
  }
]
