[
  {
    "id": "copy-marginalia",
    "locationId": "archive-hall",
    "durationSeconds": 6,
    "rewards": [{ "kind": "skillXp", "skillId": "lore", "amount": 3 }]
  },
  {
    "id": "practice-forms",
    "locationId": "sparring-court",
    "durationSeconds": 9,
    "rewards": [{ "kind": "skillXp", "skillId": "discipline", "amount": 4 }]
  },
  {
    "id": "tend-moonvines",
    "locationId": "glasshouse",
    "durationSeconds": 8,
    "rewards": [
      { "kind": "resource", "resourceId": "moonvine-cutting", "amount": 1 },
      { "kind": "skillXp", "skillId": "survival", "amount": 2 }
    ]
  }
]
