[
  {
    "id": "gather-rumors",
    "locationId": "crossroads",
    "durationSeconds": 5,
    "rewards": [{ "kind": "skillXp", "skillId": "lore", "amount": 2 }]
  },
  {
    "id": "fight-goblin",
    "locationId": "crossroads",
    "durationSeconds": 1,
    "enemyId": "goblin",
    "rewards": [{ "kind": "skillXp", "skillId": "attack", "amount": 1 }]
  },
  {
    "id": "fight-ork",
    "locationId": "crossroads",
    "durationSeconds": 1,
    "enemyId": "ork",
    "rewards": [{ "kind": "skillXp", "skillId": "attack", "amount": 1 }]
  },
  {
    "id": "fight-troll",
    "locationId": "crossroads",
    "durationSeconds": 1,
    "enemyId": "troll",
    "rewards": [{ "kind": "skillXp", "skillId": "attack", "amount": 1 }]
  },
  {
    "id": "forage-embers",
    "locationId": "emberwood",
    "durationSeconds": 8,
    "rewards": [
      { "kind": "item", "itemId": "emberleaf", "amount": 1 },
      { "kind": "skillXp", "skillId": "survival", "amount": 3 }
    ]
  },
  {
    "id": "survey-stonework",
    "locationId": "old-quarry",
    "durationSeconds": 10,
    "rewards": [{ "kind": "skillXp", "skillId": "craft", "amount": 4 }]
  }
]
